{
  "$schema": "../Schemas/research-migration-receipt-v1.json",
  "destinationImportCommit": "41a8e1920c50e46da14e10273fe9f71d496e5027",
  "batch": "Research-B02-revalidated",
  "manifestSHA256": "4ee326eb712972d1e915273a6ef4e31995d064a2578f6c0e756f7661d4f8942a",
  "programme": "https://github.com/swift-institute/.github/issues/527",
  "task": "https://github.com/swift-institute/Research/issues/18",
  "historyImport": false,
  "sourceHistoryRetained": true,
  "imports": [
    { "sourceRepository": "swift-foundations/swift-numerics", "sourceCommit": "669704987bb27f984b87cf7e4cc2b1307e11b615", "sourcePath": "Research", "sourceTree": "add7bb87d4a5678c992157d109541da1ef218362", "destinationPath": "Packages/swift-numerics", "provenanceIndex": "Packages/swift-numerics/_provenance.json", "equality": { "fileList": "verified", "blobs": "verified" } },
    { "sourceRepository": "swift-foundations/swift-paths", "sourceCommit": "239bbb5f5a6760c69d5fae6d638d86d267ca6f45", "sourcePath": "Research", "sourceTree": "f87e8496cf870edfef6e09e82b00937f22758f98", "destinationPath": "Packages/swift-paths", "provenanceIndex": "Packages/swift-paths/_provenance.json", "equality": { "fileList": "verified", "blobs": "verified" } },
    { "sourceRepository": "swift-foundations/swift-pdf", "sourceCommit": "caa97a77c605d82af6d6e44009fe80bf2a8823be", "sourcePath": "Research", "sourceTree": "147ebd343a3c3d634ce168f7834320e516c190f0", "destinationPath": "Packages/swift-pdf", "provenanceIndex": "Packages/swift-pdf/_provenance.json", "equality": { "fileList": "verified", "blobs": "verified" } },
    { "sourceRepository": "swift-foundations/swift-pdf-html-render", "sourceCommit": "92d1924585aad117f71a1519db352e330e6c1cea", "sourcePath": "Research", "sourceTree": "45bc3a319bd2c156aafe9a4c125cab2d4529b64a", "destinationPath": "Packages/swift-pdf-html-render", "provenanceIndex": "Packages/swift-pdf-html-render/_provenance.json", "equality": { "fileList": "verified", "blobs": "verified" } },
    { "sourceRepository": "swift-foundations/swift-pdf-render", "sourceCommit": "6289c681e0fb9b096351e611f1ae39ee2410b87c", "sourcePath": "Research", "sourceTree": "0dd94671fa89c888292e5b98283c5a7deea761a9", "destinationPath": "Packages/swift-pdf-render", "provenanceIndex": "Packages/swift-pdf-render/_provenance.json", "equality": { "fileList": "verified", "blobs": "verified" } },
    { "sourceRepository": "swift-foundations/swift-plist", "sourceCommit": "80d6f567f8a8809bfee65ee302aca01b56af025d", "sourcePath": "Research", "sourceTree": "54442eea001b6740ddd13445b22634006fc30269", "destinationPath": "Packages/swift-plist", "provenanceIndex": "Packages/swift-plist/_provenance.json", "equality": { "fileList": "verified", "blobs": "verified" } },
    { "sourceRepository": "swift-foundations/swift-posix", "sourceCommit": "ab4b8484e264ef50ebcb3065b27c7596662b1568", "sourcePath": "Research", "sourceTree": "3a9d5332750fe581fcdd4039ad43cfc15125c430", "destinationPath": "Packages/swift-posix", "provenanceIndex": "Packages/swift-posix/_provenance.json", "equality": { "fileList": "verified", "blobs": "verified" } },
    { "sourceRepository": "swift-foundations/swift-random", "sourceCommit": "0faa6f250f3bb3397d0ea313efd8b711c5f440d8", "sourcePath": "Research", "sourceTree": "3c874408fd57a10bc77517de7cdad97dfc5b67e7", "destinationPath": "Packages/swift-random", "provenanceIndex": "Packages/swift-random/_provenance.json", "equality": { "fileList": "verified", "blobs": "verified" } },
    { "sourceRepository": "swift-foundations/swift-source", "sourceCommit": "1fd4b19f472f2905dc398af59cf304bf9c48f9e8", "sourcePath": "Research", "sourceTree": "c9fd5d4ac06c21a4bf514997ccf4c98f4c2fea51", "destinationPath": "Packages/swift-source", "provenanceIndex": "Packages/swift-source/_provenance.json", "equality": { "fileList": "verified", "blobs": "verified" } },
    { "sourceRepository": "swift-foundations/swift-strings", "sourceCommit": "0f102249e08258441cbc0d6fba81e559cdb6b586", "sourcePath": "Research", "sourceTree": "b5a41bd90cc6a7d94f15ff512d37f1f2d3627320", "destinationPath": "Packages/swift-strings", "provenanceIndex": "Packages/swift-strings/_provenance.json", "equality": { "fileList": "verified", "blobs": "verified" } },
    { "sourceRepository": "swift-foundations/swift-svg-render", "sourceCommit": "768827e8a872c40e754b9c4a247aac0086468038", "sourcePath": "Research", "sourceTree": "8c15698d3e823ea112daa0c86feb9883bff86228", "destinationPath": "Packages/swift-svg-render", "provenanceIndex": "Packages/swift-svg-render/_provenance.json", "equality": { "fileList": "verified", "blobs": "verified" } },
    { "sourceRepository": "swift-foundations/swift-testing", "sourceCommit": "8d680b3c6aedd9417d5d1d6d4b8ea9198375a933", "sourcePath": "Research", "sourceTree": "f9cc3565ccec478e109ee14d70da5f284557eb9b", "destinationPath": "Packages/swift-testing", "provenanceIndex": "Packages/swift-testing/_provenance.json", "equality": { "fileList": "verified", "blobs": "verified" } }
  ]
}
