{
  "$schema": "../Schemas/research-migration-receipt-v1.json",
  "destinationImportCommit": "d5bdb4fae8a68cf066c73ed9d7a9cef222bebc95",
  "batch": "Research-B06",
  "manifestSHA256": "4ee326eb712972d1e915273a6ef4e31995d064a2578f6c0e756f7661d4f8942a",
  "programme": "https://github.com/swift-institute/.github/issues/527",
  "task": "https://github.com/swift-institute/.github/issues/527",
  "historyImport": false,
  "sourceHistoryRetained": true,
  "imports": [
    {
      "sourceRepository": "swift-primitives/swift-list-primitives",
      "sourceCommit": "74dac296da6b1444049d46fb753e043a81123b0e",
      "sourcePath": "Research",
      "sourceTree": "8b8c94a7f32a23b6830d328af4fff3fcab42b307",
      "destinationPath": "Packages/swift-list-primitives",
      "provenanceIndex": "Packages/swift-list-primitives/_provenance.json",
      "equality": {
        "fileList": "verified",
        "blobs": "verified"
      }
    },
    {
      "sourceRepository": "swift-primitives/swift-loader-primitives",
      "sourceCommit": "38d165b520592aff4d631b8c3c066f6b174e3fdc",
      "sourcePath": "Research",
      "sourceTree": "9a10168322cfc4133cf20cda5fce64f618e3b5c4",
      "destinationPath": "Packages/swift-loader-primitives",
      "provenanceIndex": "Packages/swift-loader-primitives/_provenance.json",
      "equality": {
        "fileList": "verified",
        "blobs": "verified"
      }
    },
    {
      "sourceRepository": "swift-primitives/swift-machine-primitives",
      "sourceCommit": "d8745c47e1f7e7d8f56322218018d5d51313ae7f",
      "sourcePath": "Research",
      "sourceTree": "712349bc56d9db83dd8dbed1c98bc63d2a96e796",
      "destinationPath": "Packages/swift-machine-primitives",
      "provenanceIndex": "Packages/swift-machine-primitives/_provenance.json",
      "equality": {
        "fileList": "verified",
        "blobs": "verified"
      }
    },
    {
      "sourceRepository": "swift-primitives/swift-memory-cursor-primitives",
      "sourceCommit": "70bb8a7ebe0dca4132d605a75bbdb60dfe1c89df",
      "sourcePath": "Research",
      "sourceTree": "c7d9522b2d4eca6f9ff052e8985c2f1299ba6d03",
      "destinationPath": "Packages/swift-memory-cursor-primitives",
      "provenanceIndex": "Packages/swift-memory-cursor-primitives/_provenance.json",
      "equality": {
        "fileList": "verified",
        "blobs": "verified"
      }
    },
    {
      "sourceRepository": "swift-primitives/swift-memory-primitives",
      "sourceCommit": "039d02f47c8cc88069b4cae44fec78493af57b7f",
      "sourcePath": "Research",
      "sourceTree": "4b617c808fff419a6888cf9f70620064fd8badc5",
      "destinationPath": "Packages/swift-memory-primitives",
      "provenanceIndex": "Packages/swift-memory-primitives/_provenance.json",
      "equality": {
        "fileList": "verified",
        "blobs": "verified"
      }
    },
    {
      "sourceRepository": "swift-primitives/swift-optic-primitives",
      "sourceCommit": "d5ce5d8f427ff53488538192d2fd7984b5b5326f",
      "sourcePath": "Research",
      "sourceTree": "8a3010b60ef191b24f29ad2b5c0d2418f022a60f",
      "destinationPath": "Packages/swift-optic-primitives",
      "provenanceIndex": "Packages/swift-optic-primitives/_provenance.json",
      "equality": {
        "fileList": "verified",
        "blobs": "verified"
      }
    },
    {
      "sourceRepository": "swift-primitives/swift-order-primitives",
      "sourceCommit": "0c9a70d7a637a2e9f4fec2131c82d9c77b1c07f5",
      "sourcePath": "Research",
      "sourceTree": "de4a1fe3b55a076e87a0558a6720a43244f79a4b",
      "destinationPath": "Packages/swift-order-primitives",
      "provenanceIndex": "Packages/swift-order-primitives/_provenance.json",
      "equality": {
        "fileList": "verified",
        "blobs": "verified"
      }
    },
    {
      "sourceRepository": "swift-primitives/swift-ordinal-primitives",
      "sourceCommit": "783d0208aebe849635e6e5c7a05633c821512209",
      "sourcePath": "Research",
      "sourceTree": "5c657800d3363c59ae16759a7a3e99c55e205029",
      "destinationPath": "Packages/swift-ordinal-primitives",
      "provenanceIndex": "Packages/swift-ordinal-primitives/_provenance.json",
      "equality": {
        "fileList": "verified",
        "blobs": "verified"
      }
    },
    {
      "sourceRepository": "swift-primitives/swift-pair-primitives",
      "sourceCommit": "531add7faf7dc3fadec0de919cf833b8f463dfc8",
      "sourcePath": "Research",
      "sourceTree": "503309ef3e39c229239bd8f30f8363cc524dcf5f",
      "destinationPath": "Packages/swift-pair-primitives",
      "provenanceIndex": "Packages/swift-pair-primitives/_provenance.json",
      "equality": {
        "fileList": "verified",
        "blobs": "verified"
      }
    },
    {
      "sourceRepository": "swift-primitives/swift-parser-machine-primitives",
      "sourceCommit": "5883aaae7eea56c6d1b751bdda2b8ffcfb6baa64",
      "sourcePath": "Research",
      "sourceTree": "1c288f264810fab50fec7f7982d94ceea1d0c2c6",
      "destinationPath": "Packages/swift-parser-machine-primitives",
      "provenanceIndex": "Packages/swift-parser-machine-primitives/_provenance.json",
      "equality": {
        "fileList": "verified",
        "blobs": "verified"
      }
    },
    {
      "sourceRepository": "swift-primitives/swift-parser-primitives",
      "sourceCommit": "86ff390f5ed9fd04d04a294c24ce0023d2e27c5c",
      "sourcePath": "Research",
      "sourceTree": "3c71023f402d4da6e7889212b14c9c1f00b04187",
      "destinationPath": "Packages/swift-parser-primitives",
      "provenanceIndex": "Packages/swift-parser-primitives/_provenance.json",
      "equality": {
        "fileList": "verified",
        "blobs": "verified"
      }
    }
  ]
}
