{
  "$schema": "../Schemas/research-migration-receipt-v1.json",
  "destinationImportCommit": "2a6808685dd22888a717d843be82d1a73131ff5e",
  "batch": "Research-B09",
  "manifestSHA256": "4ee326eb712972d1e915273a6ef4e31995d064a2578f6c0e756f7661d4f8942a",
  "programme": "https://github.com/swift-institute/.github/issues/527",
  "task": "https://github.com/swift-institute/.github/issues/527",
  "historyImport": false,
  "sourceHistoryRetained": true,
  "imports": [
    {
      "sourceRepository": "swift-w3c/swift-w3c-xml",
      "sourceCommit": "4803fd1ca687792279dbb97df024c4c664a9c5da",
      "sourcePath": "Research",
      "sourceTree": "8901f111787ab6c781b470cae7d0951d18bb56f5",
      "destinationPath": "Packages/swift-w3c-xml",
      "provenanceIndex": "Packages/swift-w3c-xml/_provenance.json",
      "equality": {
        "fileList": "verified",
        "blobs": "verified"
      }
    }
  ]
}
